{
  "evaluationId": "salience-01",
  "summary": "High impact and exigency with familiar conditions.",
  "verdict": "pass",
  "profile": {
    "id": "salience.evaluation.v1",
    "version": "1.0.0"
  },
  "scope": {
    "scale": "event",
    "subjectRefs": [
      "cidv1-event-01"
    ]
  },
  "assessedAt": "2026-10-02T12:00:00.000Z",
  "validTime": {
    "validAt": "2026-10-02T12:00:00.000Z"
  },
  "receiptRefs": [
    "cidv1-receipt-01"
  ],
  "provenanceRefs": [
    "cidv1-provenance-01"
  ],
  "assessment": {
    "impact": {
      "status": "observed",
      "value": {
        "representation": "ordinal",
        "schemaRef": "salience.ordinal.v1",
        "allowedLevels": [
          "low",
          "high"
        ],
        "level": "high"
      },
      "uncertainty": {
        "status": "known"
      },
      "evidenceRefs": [
        "cidv1-impact-01"
      ],
      "provenanceRefs": []
    },
    "exigency": {
      "status": "observed",
      "value": {
        "representation": "ordinal",
        "schemaRef": "salience.ordinal.v1",
        "allowedLevels": [
          "low",
          "high"
        ],
        "level": "high"
      },
      "uncertainty": {
        "status": "known"
      },
      "evidenceRefs": [
        "cidv1-exigency-01"
      ],
      "provenanceRefs": []
    },
    "novelty": {
      "status": "observed",
      "value": {
        "representation": "ordinal",
        "schemaRef": "salience.ordinal.v1",
        "allowedLevels": [
          "low",
          "high"
        ],
        "level": "low"
      },
      "uncertainty": {
        "status": "known"
      },
      "evidenceRefs": [
        "cidv1-novelty-01"
      ],
      "provenanceRefs": [],
      "baselineRefs": [
        "cidv1-expectation-01"
      ],
      "phenomenonRefs": [
        "cidv1-event-01"
      ]
    }
  }
}
